{
  "schema": "mantle-source-observation-v1",
  "source_kind": "fixed-url",
  "locator_class": "url",
  "locator_hint": "https://example.invalid/source.tar",
  "normalized_projection": ".",
  "snapshot_profile": "archive-tree-v1",
  "content_blake3": "aaaaaaaaaaaaaaaaaaaaaaaaaaaaaaaaaaaaaaaaaaaaaaaaaaaaaaaaaaaaaaaa",
  "observation_blake3": "cfee9476367a424a79df0fa2d8ed67074fc24eaf49fb50db0b1a8eabd9f46e32",
  "provenance": "complete",
  "non_claim": "source-observation-binds-supplied-origin-projection-profile-and-content-facts-without-proving-ownership-trust-review-or-correctness"
}
